{
  "schema": "voxprint-model/1",
  "id": "dinov2-base",
  "display_name": "DINOv2 base (image embeddings)",
  "app_ids": [
    "model-forge"
  ],
  "task": "image-feature-extraction",
  "license": "apache-2.0",
  "files": [
    {
      "path": ".gitattributes",
      "size": 1519,
      "sha256": "11ad7efa24975ee4b0c3c3a38ed18737f0658a5f75a0a96787b576a78a023361"
    },
    {
      "path": "README.md",
      "size": 3047,
      "sha256": "a25f88d48fa60f0c82a6573285ce4f01d60411c986b2de03feb68cf65480eb18"
    },
    {
      "path": "config.json",
      "size": 548,
      "sha256": "f7ff4cfa73d2f70647dbf6950541ad25d73082d54c2e7e9bded160c7656b2a70"
    },
    {
      "path": "model.safetensors",
      "size": 346345912,
      "sha256": "d73036b56966966d07975d696bde331762f37297e2f095de8cea0040c3aa0841"
    },
    {
      "path": "preprocessor_config.json",
      "size": 436,
      "sha256": "14e780d86fa1861f8751f868d7f45425b5feb55c38ca26f152ca5097ab30f828"
    },
    {
      "path": "pytorch_model.bin",
      "size": 346392713,
      "sha256": "014965d9e330e7f4bff8ddcbee9df5e4f2ca032b2f5180942a6edb454783e75d"
    }
  ],
  "mirrors": [
    {
      "kind": "hf",
      "ref": "facebook/dinov2-base",
      "revision": "f9e44c814b77203eaa57a6bdbbd535f21ede1415"
    }
  ],
  "tier": {
    "min_vram_gib": 0.0,
    "recommended_vram_gib": 2.0,
    "gpu_min_cc": 0.0
  },
  "runtime": {
    "engine": "diffusers",
    "version_req": ">=0.37.1,<0.38"
  },
  "base_model": "facebook/dinov2-base",
  "card_url": "https://huggingface.co/facebook/dinov2-base",
  "flags": [],
  "on_demand": true,
  "build": {
    "forge_version": "0.1.0",
    "tag": "",
    "date": "2026-10-17"
  }
}
