{
  "schema": "voxprint-model/1",
  "app_ids": [
    "audiobook-builder"
  ],
  "task": "speaker-diarization",
  "flags": [],
  "on_demand": false,
  "base_model": "",
  "runtime": {
    "engine": "diffusers",
    "version_req": ">=0.30"
  },
  "build": {
    "forge_version": "0.1.0",
    "tag": "",
    "date": "2026-10-11"
  },
  "id": "pyannote-speaker-diarization-community-1",
  "display_name": "Pyannote speaker diarization",
  "license": "cc-by-4.0",
  "card_url": "https://huggingface.co/Mitroshenkov87/voxprint-pyannote-speaker-diarization-community-1",
  "tier": {
    "min_vram_gib": 8,
    "recommended_vram_gib": 8,
    "gpu_min_cc": 6.0
  },
  "files": [
    {
      "path": "config.yaml",
      "size": 444,
      "sha256": "5ce2bfa9a938dc132cec1172592d65173cbb8f444ea1e4133f10f9391de155be"
    },
    {
      "path": "embedding/pytorch_model.bin",
      "size": 26646242,
      "sha256": "6f10ff60898a1d185fa22e1d11e0bfa8a92efec811f11bca48cb8cafebefd929"
    },
    {
      "path": "plda/plda.npz",
      "size": 133852,
      "sha256": "9b77bcd840692710dd3496f62ecfeed8d8e5f002fd991b785079b244eab7d255"
    },
    {
      "path": "plda/xvec_transform.npz",
      "size": 134376,
      "sha256": "325f1ce8e48f7e55e9c8aa47e05d2766b7c48c4b25b8de8dd751e7a4cc5fbe8f"
    },
    {
      "path": "segmentation/pytorch_model.bin",
      "size": 5906507,
      "sha256": "7ad24338d844fb95985486eb1a464e32d229f6d7a03c9abe60f978bacf3f816e"
    }
  ],
  "mirrors": [
    {
      "kind": "hf",
      "ref": "Mitroshenkov87/voxprint-pyannote-speaker-diarization-community-1",
      "revision": "9c851af7"
    },
    {
      "kind": "kaggle",
      "ref": "mitroshenkov87/voxprint-pyannote-speaker-diarization-community-1",
      "revision": "9c851af7"
    }
  ]
}
